{
  "statement_type": "BALANCE_SHEET",
  "line_items": [
    {
      "name_en": "Assets",
      "name_ar": "الموجودات:",
      "values": [],
      "level": 0,
      "parent_index": null,
      "is_total": false,
      "is_subtotal": false,
      "note_number": null,
      "source": {
        "table_id": "t1",
        "row_index": 0,
        "page": 1
      },
      "confidence": 0.95,
      "order": 0
    },
    {
      "name_en": "Non-current assets",
      "name_ar": "الموجودات غير المتداولة:",
      "values": [],
      "level": 1,
      "parent_index": 0,
      "is_total": false,
      "is_subtotal": false,
      "note_number": null,
      "source": {
        "table_id": "t1",
        "row_index": 1,
        "page": 1
      },
      "confidence": 0.95,
      "order": 1
    },
    {
      "name_en": "Property, plant and equipment - net",
      "name_ar": "الآلات والممتلكات والمعدات - بالصافي",
      "values": [
        {
          "fiscal_year": 2025,
          "amount": 697468,
          "column_index": 2
        },
        {
          "fiscal_year": 2024,
          "amount": 929956,
          "column_index": 3
        }
      ],
      "level": 2,
      "parent_index": 1,
      "is_total": false,
      "is_subtotal": false,
      "note_number": "4",
      "source": {
        "table_id": "t1",
        "row_index": 2,
        "page": 1
      },
      "confidence": 0.98,
      "order": 2
    },
    {
      "name_en": "Total non-current assets",
      "name_ar": "إجمالي الموجودات غير المتداولة",
      "values": [
        {
          "fiscal_year": 2025,
          "amount": 697468,
          "column_index": 2
        },
        {
          "fiscal_year": 2024,
          "amount": 929956,
          "column_index": 3
        }
      ],
      "level": 1,
      "parent_index": 0,
      "is_total": true,
      "is_subtotal": false,
      "note_number": null,
      "source": {
        "table_id": "t1",
        "row_index": 3,
        "page": 1
      },
      "confidence": 0.98,
      "order": 3
    },
    {
      "name_en": "Current assets",
      "name_ar": "الموجودات المتداولة:",
      "values": [],
      "level": 1,
      "parent_index": 0,
      "is_total": false,
      "is_subtotal": false,
      "note_number": null,
      "source": {
        "table_id": "t1",
        "row_index": 4,
        "page": 1
      },
      "confidence": 0.95,
      "order": 4
    },
    {
      "name_en": "Inventory",
      "name_ar": "المخزون",
      "values": [
        {
          "fiscal_year": 2025,
          "amount": 2954122,
          "column_index": 2
        },
        {
          "fiscal_year": 2024,
          "amount": 995622,
          "column_index": 3
        }
      ],
      "level": 2,
      "parent_index": 4,
      "is_total": false,
      "is_subtotal": false,
      "note_number": "5",
      "source": {
        "table_id": "t1",
        "row_index": 5,
        "page": 1
      },
      "confidence": 0.98,
      "order": 5
    },
    {
      "name_en": "Accounts receivable",
      "name_ar": "ذمم مدينة",
      "values": [
        {
          "fiscal_year": 2025,
          "amount": 668499,
          "column_index": 2
        },
        {
          "fiscal_year": 2024,
          "amount": 215477,
          "column_index": 3
        }
      ],
      "level": 2,
      "parent_index": 4,
      "is_total": false,
      "is_subtotal": false,
      "note_number": "6",
      "source": {
        "table_id": "t1",
        "row_index": 6,
        "page": 1
      },
      "confidence": 0.98,
      "order": 6
    },
    {
      "name_en": "Cash and cash equivalents",
      "name_ar": "النقد وما في حكمه",
      "values": [
        {
          "fiscal_year": 2025,
          "amount": 334935,
          "column_index": 2
        },
        {
          "fiscal_year": 2024,
          "amount": 185890,
          "column_index": 3
        }
      ],
      "level": 2,
      "parent_index": 4,
      "is_total": false,
      "is_subtotal": false,
      "note_number": "7",
      "source": {
        "table_id": "t1",
        "row_index": 7,
        "page": 1
      },
      "confidence": 0.98,
      "order": 7
    },
    {
      "name_en": "Prepaid expenses and other debit balances",
      "name_ar": "مصروفات مدفوعة مقدماً وأرصدة مدينة أخرى",
      "values": [
        {
          "fiscal_year": 2025,
          "amount": 477388,
          "column_index": 2
        },
        {
          "fiscal_year": 2024,
          "amount": 70115,
          "column_index": 3
        }
      ],
      "level": 2,
      "parent_index": 4,
      "is_total": false,
      "is_subtotal": false,
      "note_number": "8",
      "source": {
        "table_id": "t1",
        "row_index": 8,
        "page": 1
      },
      "confidence": 0.98,
      "order": 8
    },
    {
      "name_en": "Total current assets",
      "name_ar": "إجمالي الموجودات المتداولة",
      "values": [
        {
          "fiscal_year": 2025,
          "amount": 4434944,
          "column_index": 2
        },
        {
          "fiscal_year": 2024,
          "amount": 1467104,
          "column_index": 3
        }
      ],
      "level": 1,
      "parent_index": 0,
      "is_total": true,
      "is_subtotal": false,
      "note_number": null,
      "source": {
        "table_id": "t1",
        "row_index": 9,
        "page": 1
      },
      "confidence": 0.98,
      "order": 9
    },
    {
      "name_en": "Total assets",
      "name_ar": "مجموع الموجودات",
      "values": [
        {
          "fiscal_year": 2025,
          "amount": 5132412,
          "column_index": 2
        },
        {
          "fiscal_year": 2024,
          "amount": 2397060,
          "column_index": 3
        }
      ],
      "level": 0,
      "parent_index": null,
      "is_total": true,
      "is_subtotal": false,
      "note_number": null,
      "source": {
        "table_id": "t1",
        "row_index": 10,
        "page": 1
      },
      "confidence": 0.98,
      "order": 10
    },
    {
      "name_en": "Partners' equity and liabilities",
      "name_ar": "حقوق الشركاء والإلتزامات",
      "values": [],
      "level": 0,
      "parent_index": null,
      "is_total": false,
      "is_subtotal": false,
      "note_number": null,
      "source": {
        "table_id": "t1",
        "row_index": 11,
        "page": 1
      },
      "confidence": 0.95,
      "order": 11
    },
    {
      "name_en": "Capital",
      "name_ar": "رأس المال",
      "values": [
        {
          "fiscal_year": 2025,
          "amount": 10000,
          "column_index": 2
        },
        {
          "fiscal_year": 2024,
          "amount": 10000,
          "column_index": 3
        }
      ],
      "level": 2,
      "parent_index": 14,
      "is_total": false,
      "is_subtotal": false,
      "note_number": "9",
      "source": {
        "table_id": "t1",
        "row_index": 12,
        "page": 1
      },
      "confidence": 0.98,
      "order": 12
    },
    {
      "name_en": "Retained earnings (losses)",
      "name_ar": "الأرباح (الخسائر) المبقاة",
      "values": [
        {
          "fiscal_year": 2025,
          "amount": 4837572,
          "column_index": 2
        },
        {
          "fiscal_year": 2024,
          "amount": 1455391,
          "column_index": 3
        }
      ],
      "level": 2,
      "parent_index": 14,
      "is_total": false,
      "is_subtotal": false,
      "note_number": null,
      "source": {
        "table_id": "t1",
        "row_index": 13,
        "page": 1
      },
      "confidence": 0.98,
      "order": 13
    },
    {
      "name_en": "Total partners' equity",
      "name_ar": "إجمالي حقوق الشركاء",
      "values": [
        {
          "fiscal_year": 2025,
          "amount": 4847572,
          "column_index": 2
        },
        {
          "fiscal_year": 2024,
          "amount": 1465391,
          "column_index": 3
        }
      ],
      "level": 1,
      "parent_index": 11,
      "is_total": true,
      "is_subtotal": false,
      "note_number": null,
      "source": {
        "table_id": "t1",
        "row_index": 14,
        "page": 1
      },
      "confidence": 0.98,
      "order": 14
    },
    {
      "name_en": "Non-current liabilities",
      "name_ar": "الإلتزامات غير المتداولة:",
      "values": [],
      "level": 1,
      "parent_index": 11,
      "is_total": false,
      "is_subtotal": false,
      "note_number": null,
      "source": {
        "table_id": "t1",
        "row_index": 15,
        "page": 1
      },
      "confidence": 0.95,
      "order": 15
    },
    {
      "name_en": "Due to related parties",
      "name_ar": "مستحق الي اطراف ذات علاقة",
      "values": [
        {
          "fiscal_year": 2025,
          "amount": null,
          "column_index": 2
        },
        {
          "fiscal_year": 2024,
          "amount": 485689,
          "column_index": 3
        }
      ],
      "level": 2,
      "parent_index": 15,
      "is_total": false,
      "is_subtotal": false,
      "note_number": "10",
      "source": {
        "table_id": "t1",
        "row_index": 16,
        "page": 1
      },
      "confidence": 0.98,
      "order": 16
    },
    {
      "name_en": "Provision for end-of-service benefits",
      "name_ar": "مخصص مكافأة نهاية الخدمة",
      "values": [
        {
          "fiscal_year": 2025,
          "amount": 51299,
          "column_index": 2
        },
        {
          "fiscal_year": 2024,
          "amount": 21455,
          "column_index": 3
        }
      ],
      "level": 2,
      "parent_index": 15,
      "is_total": false,
      "is_subtotal": false,
      "note_number": "11",
      "source": {
        "table_id": "t1",
        "row_index": 17,
        "page": 1
      },
      "confidence": 0.98,
      "order": 17
    },
    {
      "name_en": "Total non-current liabilities",
      "name_ar": "إجمالي الإلتزامات غير المتداولة",
      "values": [
        {
          "fiscal_year": 2025,
          "amount": 51299,